{
  "schemaVersion": "1.0",
  "id": "take_a",
  "kind": "image",
  "contentHash": "aaaaaaaaaaaaaaaaaaaaaaaaaaaaaaaaaaaaaaaaaaaaaaaaaaaaaaaaaaaaaaaa",
  "relativePath": "media/logo.png",
  "probe": {
    "durationUs": null,
    "video": {
      "width": 1920,
      "height": 1080,
      "rotation": 0,
      "fpsNum": null,
      "fpsDen": null,
      "vfr": false,
      "codec": "png",
      "colorTransfer": "bt709",
      "colorPrimaries": "bt709",
      "pixFmt": "yuv420p"
    },
    "audio": null
  },
  "derived": {
    "proxy": "bbbbbbbbbbbbbbbbbbbbbbbbbbbbbbbbbbbbbbbbbbbbbbbbbbbbbbbbbbbbbbbb",
    "analysisWav": null
  },
  "rights": {
    "origin": "user",
    "license": null,
    "attribution": null,
    "sourceUrl": null
  },
  "provenance": {
    "importedAt": "2026-10-05T12:00:00Z",
    "importer": "media_v1"
  },
  "permissionScope": "local_only"
}
